phrasal_verb,example,description
knock off,They’d knocked off two banks the previous week.,"['to be much better than someone or something', 'to have sex with someone', 'to murder someone', 'to produce something quickly and carelessly, often a copy of something else', 'to reduce a price or an amount', 'to steal money or property from a place', 'to steal something', 'to stop working', 'used for telling someone to stop doing something', 'used for threatening to hit someone and hurt them very badly']"
knock off,Do they come out here at night to knock off wallabies or anything?,"['to be much better than someone or something', 'to have sex with someone', 'to murder someone', 'to produce something quickly and carelessly, often a copy of something else', 'to reduce a price or an amount', 'to steal money or property from a place', 'to steal something', 'to stop working', 'used for telling someone to stop doing something', 'used for threatening to hit someone and hurt them very badly']"
knock out,All the enthusiasm had been knocked out of him.,"['to destroy something, or to stop it working', 'to do a lot of work in order to achieve something', 'to impress someone very much', 'to make someone feel very shocked or upset', 'to make someone leave a competition by defeating them', 'to make someone lose a quality', 'to make someone unconscious', 'to produce something quickly or carelessly']"
knock out,England had been knocked out of the World Cup by West Germany.,"['to destroy something, or to stop it working', 'to do a lot of work in order to achieve something', 'to impress someone very much', 'to make someone feel very shocked or upset', 'to make someone leave a competition by defeating them', 'to make someone lose a quality', 'to make someone unconscious', 'to produce something quickly or carelessly']"
knock over,"`But Hugh Hunt its working with the Russians, and they are planning to knock over the Carlyle Museum, right?","['same as knock down', 'to steal money or goods from a bank or business, especially using violence']"
knock over,Over 100 people are knocked over on Britain’s roads every day.,"['same as knock down', 'to steal money or goods from a bank or business, especially using violence']"
knock together,The little bars have been knocked together to make an awkward low room.,"['to make two rooms or buildings into one room or building by removing a wall that separates them', 'to produce something quickly and easily', 'used for threatening to punish two people or groups who are fighting']"
knock together,"While you get dressed, I’ll knock together a quick dinner.","['to make two rooms or buildings into one room or building by removing a wall that separates them', 'to produce something quickly and easily', 'used for threatening to punish two people or groups who are fighting']"
knock up,"A knock-up village with an airstrip, solid bungalows round a massive supplies hangar.","['same as knock', 'to make a woman pregnant', 'to wake or call someone by knocking on their door']"
knock up,"You can't just knock up a few tons of maraging steel in the back streets of Cairo, it's not that easy.","['same as knock', 'to make a woman pregnant', 'to wake or call someone by knocking on their door']"
know from,Most people wouldn’t know it from real champagne.,['to recognize the difference between two people or things']
know of,Do you know of anyone who’s looking for a new car?,"['to know about someone or something, but not know any details', 'to know that someone or something exists and who, what, or where they are', 'used for answering that you think something is not true, although you are not completely certain']"
know of,I only know of one case in which this has happened.,"['to know about someone or something, but not know any details', 'to know that someone or something exists and who, what, or where they are', 'used for answering that you think something is not true, although you are not completely certain']"
knuckle down,"But now we'd better lunch, then knuckle down to our chores.","['to start working hard, especially when you should have done this earlier']"
knuckle down,Fi said I was being self-indulgent and that I should knuckle down to my career.,"['to start working hard, especially when you should have done this earlier']"
knuckle under,The pressure to knuckle under was immense.,['to do what someone tells you to do']
knuckle under,He wasn’t going to knuckle under to some woman.,['to do what someone tells you to do']
labour under,Many countries labour under a huge burden of debt they cannot even begin to pay.,"['to continue doing something or believing something because you think that something else is true, even though it is not', 'to exist or try to live in a situation where there are serious difficulties or problems']"
labour under,"Even after a decade, she still seems to labour under the illusion that she is Party leader.","['to continue doing something or believing something because you think that something else is true, even though it is not', 'to exist or try to live in a situation where there are serious difficulties or problems']"
ladle out,The wife was at the stove to ladle out the thin soup which was to form their Christmas Feast.,"['same as ladle', 'to give large amounts of money, goods, or information to someone without thinking carefully what it will be used for']"
ladle out,Danlo coughed and bent over the oilstone to ladle out some hot dog grease melting in the pot.,"['same as ladle', 'to give large amounts of money, goods, or information to someone without thinking carefully what it will be used for']"
land in,The whole family landed on my doorstep for the weekend.,"['if a plane or boat lands people or goods somewhere, it brings them there', 'if an aircraft lands, it comes down to the ground', 'to arrive at a place by plane or boat', 'to arrive somewhere, especially unexpectedly or in a way that causes problems', 'to be in an unpleasant situation or place, or to cause someone to be in an unpleasant situation or place', 'to bring a plane down to the ground', 'to catch a fish and pull it out of the water', 'to come down to the ground or to a surface after moving or falling through the air', 'to get something that you wanted, especially a job or opportunity']"
land in,The plane landed a couple of hours before dawn.,"['if a plane or boat lands people or goods somewhere, it brings them there', 'if an aircraft lands, it comes down to the ground', 'to arrive at a place by plane or boat', 'to arrive somewhere, especially unexpectedly or in a way that causes problems', 'to be in an unpleasant situation or place, or to cause someone to be in an unpleasant situation or place', 'to bring a plane down to the ground', 'to catch a fish and pull it out of the water', 'to come down to the ground or to a surface after moving or falling through the air', 'to get something that you wanted, especially a job or opportunity']"
land on,He really landed on me for being late.,['to criticize someone severely']
land up,How did you land up studying astronomy?,"['same as land', 'to finally arrive at a place or situation after a series of events']"
land up,"We happened to land up just at the wrong party spot,"" said Gareth.","['same as land', 'to finally arrive at a place or situation after a series of events']"
land with,John was landed with the job of sorting Susan’s files when she left.,['to give someone an unpleasant job that no one else wants to do']
lap up,The jokes were crude but the audience were lapping them up.,"['same as lap', 'to enjoy something and be keen to get more of it']"
lap up,They lapped up their milk.,"['same as lap', 'to enjoy something and be keen to get more of it']"
lapse into,A hypnotized person lapses into a kind of trance.,"['to change to a different, less usual, or less helpful way of speaking or behaving, often without realizing it', 'to gradually change to a quieter or less active state']"
lapse into,Now it was her turn to lapse into thought.,"['to change to a different, less usual, or less helpful way of speaking or behaving, often without realizing it', 'to gradually change to a quieter or less active state']"
lash down,It’s been lashing down for an hour.,['to rain in large amounts and with a lot of force']
lash out,"He wanted to swear, to curse... to lash out in frustration.","['to criticize someone or something angrily', 'to spend a lot of money on something', 'to try to hit or attack someone suddenly and violently']"
lash out,His gaze became sharp and dangerous like that of a cornered animal that was prepared to lash out in order to protect itself.,"['to criticize someone or something angrily', 'to spend a lot of money on something', 'to try to hit or attack someone suddenly and violently']"
lash out at,Occasionally the patients will lash out at the nurses.,"['to criticize someone or something angrily', 'to spend a lot of money on something', 'to try to hit or attack someone suddenly and violently']"
lash out at,They lashed out at the council’s move to stop free parking.,"['to criticize someone or something angrily', 'to spend a lot of money on something', 'to try to hit or attack someone suddenly and violently']"
last out,I doubt whether our money is going to last out.,"['to continue to be enough for what people need', 'to manage to stay alive for a particular period of time']"
last out,`I was accused of having raped and murdered a twelve-year-old kid when I was last out here.,"['to continue to be enough for what people need', 'to manage to stay alive for a particular period of time']"
latch onto,The media latched onto the rumour and reported it as fact.,"['to go with someone who does not want to be with you', 'to immediately become very interested in something that you discover']"
latch onto,"They might latch onto a new juicy tidbit about somebody else, but that didn't mean they'd ever forget about Rae.","['to go with someone who does not want to be with you', 'to immediately become very interested in something that you discover']"
laugh at,I always felt as though people were laughing at me behind my back.,"['to behave in a way that shows you are not worried or frightened by something', 'to not be too serious or sensitive about yourself and the things that you do', 'to say unkind things about someone or something that are intended to make them seem silly', 'to say unkind things about someone when they are not there']"
laugh at,The other kids laughed at his haircut.,"['to behave in a way that shows you are not worried or frightened by something', 'to not be too serious or sensitive about yourself and the things that you do', 'to say unkind things about someone or something that are intended to make them seem silly', 'to say unkind things about someone when they are not there']"
laugh off,As if he'd picked up her change of mood he choked the laugh off.,['to joke about something in order to show that you think it is not important or serious']
laugh off,"Much as he would have liked to laugh off what Jerry Brahms was saying, his instincts were telling him to be more cautious.",['to joke about something in order to show that you think it is not important or serious']
launch into,"You see two sides to his personality when, within minutes of our meeting, he launches into a long speech about the environment.","['to start something such as an explanation, project, or attack with a lot of enthusiasm']"
launch into,He immediately launched into a detailed account of his trip.,"['to start something such as an explanation, project, or attack with a lot of enthusiasm']"
launch out,She launched out on her own to start a new business.,"['to start a new activity, especially one that involves some risk']"
lay about,He said that his captors had laid about him with whips.,['to attack someone by hitting them']
lay aside,"The text simply means that he laid aside, or put off, those divine aspects that would have kept him from becoming a man.","['to keep or save something, especially money, so that you can use it in the future', 'to not let yourself think about or be influenced by something so that you can achieve an aim', 'to put something down and to one side because you have finished with it or want to save it until another time']"
lay aside,"‘What do you want?’ he said, laying aside his book.","['to keep or save something, especially money, so that you can use it in the future', 'to not let yourself think about or be influenced by something so that you can achieve an aim', 'to put something down and to one side because you have finished with it or want to save it until another time']"
lay before,I have some more research to do before I’m ready to lay the case before the committee.,"['to offer something to someone to study, discuss, approve etc']"
lay down,He heard the rustle of the silk bedcover being turned down and the creak of the springs as the woman lay down.,"['a way of saying ‘lie down’ that many people think is incorrect', 'to form a layer of something such as soil or mud that gradually becomes hard and develops into rock', 'to put something down in order to show you are not going to use it again, for example a weapon or tool', 'to state officially what someone must do or how they must do it', 'to tell someone what to do or how to behave in a way that shows that you expect them to obey you completely']"
lay down,The EU has laid down tough standards for water quality.,"['a way of saying ‘lie down’ that many people think is incorrect', 'to form a layer of something such as soil or mud that gradually becomes hard and develops into rock', 'to put something down in order to show you are not going to use it again, for example a weapon or tool', 'to state officially what someone must do or how they must do it', 'to tell someone what to do or how to behave in a way that shows that you expect them to obey you completely']"
lay in,"Knowing I would soon wake at Emerson's side, I lay in drowsy content enjoying the voluptuous beauty of my surroundings.",['to get and keep a supply of something such as food to use in the future']
lay in,The real danger lay in presenting the Maeve's beam to the seas once they were alongside.,['to get and keep a supply of something such as food to use in the future']
lay into,"The tweets ignored her swimming and laid into her about her face, an insecurity she has had since childhood.",['to attack someone physically or with cruel words because you are angry with them']
lay into,My parents really laid into me for being so late.,['to attack someone physically or with cruel words because you are angry with them']
lay off,Do you think he's really gonna lay off trying to get the President canned?,"['to end someone’s employment, especially temporarily, because there is not enough work for them', 'to stop doing or using something, especially for a short period of time', 'to stop doing something that is annoying someone']"
lay off,Lay off! I’m trying to study.,"['to end someone’s employment, especially temporarily, because there is not enough work for them', 'to stop doing or using something, especially for a short period of time', 'to stop doing something that is annoying someone']"
lay on,"Don’t lay it on too thick, or they’ll know you want something.","['to make something such as your admiration for someone or their achievements seem greater or more important than they really are in order to impress someone', 'to provide something such as food, entertainment, or a service, especially without charging for it', 'to tell or show something to someone, especially when you do not expect them to like it']"
lay on,"She lay on her back, her spasmodic breathing beyond control.","['to make something such as your admiration for someone or their achievements seem greater or more important than they really are in order to impress someone', 'to provide something such as food, entertainment, or a service, especially without charging for it', 'to tell or show something to someone, especially when you do not expect them to like it']"
lay out,She opened her suitcase and laid her clothes out on the bed.,"['to arrange something according to a detailed plan, for example rooms in a building, roads in a town, or areas on a piece of land', 'to explain something carefully and clearly', 'to hit someone so hard that they fall to the ground and become unconscious', 'to prepare a dead body so that people can come to see it before it is buried', 'to spend an amount of money', 'to spread something out, or to arrange things so you can see them easily']"
lay out,A display of local history material was laid out on the table.,"['to arrange something according to a detailed plan, for example rooms in a building, roads in a town, or areas on a piece of land', 'to explain something carefully and clearly', 'to hit someone so hard that they fall to the ground and become unconscious', 'to prepare a dead body so that people can come to see it before it is buried', 'to spend an amount of money', 'to spread something out, or to arrange things so you can see them easily']"
lay up,He’s still laid up with a bad back.,"['same as lay', 'to make someone stay in bed as a result of being ill or injured', 'to not use a vehicle or ship for a period of time, especially because it needs to be repaired']"
lay up,The lad lay up to his armpits in the stream and was shivering and blue about the lips.,"['same as lay', 'to make someone stay in bed as a result of being ill or injured', 'to not use a vehicle or ship for a period of time, especially because it needs to be repaired']"
laze around,Your children shouldn’t be lazing around indoors on such a nice day.,['same as laze']
laze away,You can’t laze your days away doing nothing.,"['to spend time relaxing and enjoying yourself, doing no work']"
lead into,Discussion of a client’s tax affairs will lead naturally into consideration of investment options.,['same as lead to']
lead off,"By morning there'll be maybe some marks left, and they'll lead off to the north woods, but under the trees you won't find it.",['to begin something by doing or saying something']
lead off,She led off the afternoon with questions from the audience.,['to begin something by doing or saying something']
lead on,"As he stepped into his car, he promised to get in touch with Nancy as soon as he had a lead on her stolen convertible.","['to encourage someone to do something or to expect something, especially by lying to them or promising them something that they cannot have']"
lead on,You mentioned over lunch that you might have a lead on them.,"['to encourage someone to do something or to expect something, especially by lying to them or promising them something that they cannot have']"
lead on to,Anyone who says that marijuana does not lead on to other drugs is deluded.,['same as lead to']
lead on to,French doors lead on to a terrace with a sea view.,['same as lead to']
lead to,This leads on to the second flaw in the research.,"['to begin a process that causes something to happen', 'to make someone think something']"
lead to,French doors lead on to a terrace with a sea view.,"['to begin a process that causes something to happen', 'to make someone think something']"
lead up to,"I knew he was leading up to something, but I had no idea what.","['if events, problems, actions etc lead up to an important event, they happen one after another in a way that makes it possible for the event to happen', 'to gradually direct a conversation towards a particular subject, especially one that is difficult or embarrassing', 'to happen or exist immediately before something']"
lead up to,"If she had been writing dialogue for a play, she couldn't have written it any better, to lead up to her great line.","['if events, problems, actions etc lead up to an important event, they happen one after another in a way that makes it possible for the event to happen', 'to gradually direct a conversation towards a particular subject, especially one that is difficult or embarrassing', 'to happen or exist immediately before something']"
lead with,We’ll lead with the Prime Minister’s visit to China.,"['to begin a speech, news broadcast, story etc with a particular story or subject', 'to begin an attack in boxing with a particular hand or hit']"
lead with,He led with a right jab.,"['to begin a speech, news broadcast, story etc with a particular story or subject', 'to begin an attack in boxing with a particular hand or hit']"
leak out,News leaked out that he was leaving the show.,['to become known by the public']
lean on,Everybody needs someone to lean on in times of trouble.,"['to depend on someone', 'to press the horn of a car in a determined way', 'to put pressure on someone in order to make them do something']"
lean on,If Partridge suggested he leap from a bridge he would at least lean on the rail.,"['to depend on someone', 'to press the horn of a car in a determined way', 'to put pressure on someone in order to make them do something']"
leap at,"He looked through the list of names, but none leapt out at him.","['to be immediately obvious to someone, or to immediately get their attention']"
leap in,"When they see a marketing opportunity, companies leap in.","['to do something immediately, and often with enthusiasm, as soon as you have the chance to do it']"
leap on,She found herself leaping on the suggestion.,['to be immediately very interested in something or very keen to do or have something']
leap out at,"He looked through the list of names, but none leapt out at him.","['to be immediately obvious to someone, or to immediately get their attention']"
leap upon,She found herself leaping on the suggestion.,['to be immediately very interested in something or very keen to do or have something']
leave aside,"Leaving aside the financial implications, do you really believe your proposal will solve our problem?",['to not consider something because you want to consider something else instead']
leave behind,It is not something I left behind.,"['to deliberately not think about something, especially an unpleasant experience, and not let it affect what you do in the future', 'to forget to take someone or something with you', 'to improve or progress much faster than someone or something else', 'to increase the distance by which you are ahead of someone or something', 'to not take someone or something with you when you go somewhere']"
leave behind,What do you do if your husband resents being left behind when you go to church each week?,"['to deliberately not think about something, especially an unpleasant experience, and not let it affect what you do in the future', 'to forget to take someone or something with you', 'to improve or progress much faster than someone or something else', 'to increase the distance by which you are ahead of someone or something', 'to not take someone or something with you when you go somewhere']"
leave off,"And still he kept seeing, and though there were horrors here, to be sure, nothing in him made him want to leave off his seeing.",['to stop doing something']
leave off,We're having pie and chips for tea tonight so I'll just eat the meat and the chips and leave off the pastry.,['to stop doing something']
leave out,Maybe while they're at it they could leave out the mosquitoes and the ticks as well.,"['for telling someone to stop saying something', 'to not include someone or something']"
leave out,What the hell's going to happen to her when you leave out of here because I imagine that's what you aim to do.,"['for telling someone to stop saying something', 'to not include someone or something']"
leave over,These attitudes are left over from the war.,"['if part of an amount of something such as money or food is left over, you still have some of it after you have used or eaten the rest of it', 'to still exist from the past']"
leave over,There was some ham left over from lunch.,"['if part of an amount of something such as money or food is left over, you still have some of it after you have used or eaten the rest of it', 'to still exist from the past']"
let down,The families of the victims feel that the justice system has let them down.,"['to allow someone or something to move to a lower position', 'to allow the air to go out of something such as a car tyre', 'to make someone disappointed by not doing something that they are expecting you to do', 'to make someone or something less likely to be successful or effective', 'to try to give someone bad news in a way that does not upset them too much', 'to use the extra cloth in the hem (=bottom fold) of a piece of clothing to make it longer', 'to work less hard or make more mistakes than the people who you are working with', 'to work less hard or to make more mistakes than the people who you are working with']"
let down,Any boy who misbehaves will be letting down the whole school.,"['to allow someone or something to move to a lower position', 'to allow the air to go out of something such as a car tyre', 'to make someone disappointed by not doing something that they are expecting you to do', 'to make someone or something less likely to be successful or effective', 'to try to give someone bad news in a way that does not upset them too much', 'to use the extra cloth in the hem (=bottom fold) of a piece of clothing to make it longer', 'to work less hard or make more mistakes than the people who you are working with', 'to work less hard or to make more mistakes than the people who you are working with']"
let in,Don’t let anybody in – I’ll be back in 15 minutes.,"['to allow someone to enter a house, room etc', 'to put yourself in a difficult situation', 'to talk to someone about your problems and feelings']"
let in,He climbed out of bed and opened the window to let in some fresh air.,"['to allow someone to enter a house, room etc', 'to put yourself in a difficult situation', 'to talk to someone about your problems and feelings']"
