phrasal_verb,example,description
abide by,They promised to abide by the rules of the contest.,"['to follow a rule, decision, or instruction']"
abide by,"Ah, surely,' Maram said, `this is the time to abide by the letter of his rule?","['to follow a rule, decision, or instruction']"
accord with,Hemming’s account does not accord with the police evidence.,['to agree with or be the same as something else']
account for,The increase in carbon dioxide emissions may account for changes in the climate.,"['if someone is accounted for, you know where they are and so do not worry that they are not where they should be', 'to be the reason why something exists or happens', 'to form, use, or produce a particular amount or part of a group of people or things', 'to give an explanation for something bad that has happened, especially something that you are responsible for', 'to say how you have used, or how you will use, an amount of money that you are responsible for spending, especially in your job', 'used for saying that you think what someone likes is strange']"
account for,This was fully and properly accounted for and audited.,"['if someone is accounted for, you know where they are and so do not worry that they are not where they should be', 'to be the reason why something exists or happens', 'to form, use, or produce a particular amount or part of a group of people or things', 'to give an explanation for something bad that has happened, especially something that you are responsible for', 'to say how you have used, or how you will use, an amount of money that you are responsible for spending, especially in your job', 'used for saying that you think what someone likes is strange']"
ache for,He was so lonely he ached for the sound of a human voice.,['to want something or someone very much']
act as,You speak Greek – will you act as interpreter?,['to do the job of a particular kind of person or thing']
act as,Body fat acts as an insulator.,['to do the job of a particular kind of person or thing']
act on,They were acting on the instructions of senior managers.,"['to do something because you have been given information, advice, or orders']"
act on,I’m acting on the advice of my lawyers.,"['to do something because you have been given information, advice, or orders']"
act out,He was acting out his feelings of inferiority by being overly aggressive.,"['to do something that you have planned or had previously only thought of doing', 'to express your thoughts or feelings through your words or behaviour', 'to show the events that happened in a situation by doing them again or by doing the same things as the people involved']"
act out,He was gone so fast Tesla had no choice but to act out at the same time.,"['to do something that you have planned or had previously only thought of doing', 'to express your thoughts or feelings through your words or behaviour', 'to show the events that happened in a situation by doing them again or by doing the same things as the people involved']"
act up,Agree with your partner how you are going to set boundaries for your stepson when he acts up.,"['if a part of your body or a piece of equipment acts up, it starts to become painful or to develop problems', 'if children act up, they behave badly']"
act up,I hope my back doesn’t start acting up again.,"['if a part of your body or a piece of equipment acts up, it starts to become painful or to develop problems', 'if children act up, they behave badly']"
add in,We need to add in some information about his family background.,['to include something as part of something else']
add on,He told the man at the check stand that he was installing a tub in an add-on bathroom.,"['to build an extra part onto a building', 'to include an extra thing or amount in something']"
add on,The referee added on eight minutes of injury time.,"['to build an extra part onto a building', 'to include an extra thing or amount in something']"
add on to,You might want to add on to the kitchen at a later date.,['to build an extra part onto a building']
add to,Add the amount of tax you paid to the total.,"['to make an amount or number greater by adding another amount or number', 'to make something such as a feeling or a quality greater or more extreme']"
add to,All her many expenses were added to my bill.,"['to make an amount or number greater by adding another amount or number', 'to make something such as a feeling or a quality greater or more extreme']"
add up,All these little expenses soon add up.,"['if a set of facts does not add up, you do not believe it is correct because it does not match other information that you already have', 'if small amounts add up, they gradually produce a large total', 'to calculate the total of several numbers or amounts']"
add up,Even now most governments are assuming that people's claims collectively can be made to add up by a growing economy.,"['if a set of facts does not add up, you do not believe it is correct because it does not match other information that you already have', 'if small amounts add up, they gradually produce a large total', 'to calculate the total of several numbers or amounts']"
add up to,All can add up to a bitter pill to swallow.,"['if separate amounts add up to a total amount, together they form that total', 'to combine to produce a particular result or effect']"
add up to,All that can add up to a significant weight loss.,"['if separate amounts add up to a total amount, together they form that total', 'to combine to produce a particular result or effect']"
adhere to,We must strictly adhere to the terms of the contract.,"['to obey a rule, law, agreement etc', 'to support or believe in an idea, plan, opinion etc']"
adhere to,"His followers adhere to a blend of Buddhist, Hindu, and Christian teachings.","['to obey a rule, law, agreement etc', 'to support or believe in an idea, plan, opinion etc']"
adjourn to,Let’s adjourn to the bar.,['to leave one place and move to another']
agree with,I don’t agree with corporal punishment in schools.,"['if a situation or way of living agrees with you, you enjoy it and feel happy and relaxed', 'if something such as food or drink agrees with you, it does not make you feel ill', 'to think that something is the right thing to do', 'when a verb group changes according to whether its subject is singular or plural. In English, this affects only the simple present, which adds an ‘s’ to the infinitive in the third person singular: ‘I want’ but ‘she wants’. The verbs ‘be’, ‘have’, and ‘do’ are irregular: ‘I am’, ‘you are’, ‘she is’; ‘I have’, ‘she has’; and ‘I do’, ‘she does’. In the sentences ‘A thorough search was carried out’, ‘It doesn’t matter’, and ‘The course has given me more confidence’, the verb groups ‘was carried out’, ‘doesn’t matter’, and ‘has given’ all agree with their subjects.']"
agree with,Stop taking the medicine if it doesn’t agree with you.,"['if a situation or way of living agrees with you, you enjoy it and feel happy and relaxed', 'if something such as food or drink agrees with you, it does not make you feel ill', 'to think that something is the right thing to do', 'when a verb group changes according to whether its subject is singular or plural. In English, this affects only the simple present, which adds an ‘s’ to the infinitive in the third person singular: ‘I want’ but ‘she wants’. The verbs ‘be’, ‘have’, and ‘do’ are irregular: ‘I am’, ‘you are’, ‘she is’; ‘I have’, ‘she has’; and ‘I do’, ‘she does’. In the sentences ‘A thorough search was carried out’, ‘It doesn’t matter’, and ‘The course has given me more confidence’, the verb groups ‘was carried out’, ‘doesn’t matter’, and ‘has given’ all agree with their subjects.']"
alight on,Her eyes alighted on an extraordinary sight.,['to suddenly notice or think of something']
allow for,"Beyond that, we have the strongest squad here available to us, allowing for injuries.",['to consider something when making a plan or calculation']
allow for,Neither theory allows for the other.,['to consider something when making a plan or calculation']
allow of,"The possibility must be allowed of concepts which are not concepts of any actual thing, and of names which express a sense but have no denotation.",['to show that something is possible']
allow of,The evidence allows of no other interpretation.,['to show that something is possible']
angle for,She didn’t want Ron thinking that she was angling for sympathy.,['to try to make someone give you something without asking for it directly']
answer back,I'm not going to answer back.,['to reply rudely to someone who has more authority than you']
answer back,"A survey of 2,000 parents suggests this is the age when children answer back and become influenced by their peers.",['to reply rudely to someone who has more authority than you']
answer for,But this week he has a lot to answer for.,"['to agree to be responsible for something', 'to be responsible for a lot of bad things that have happened', 'used for emphasizing that you cannot say what someone else will do or think about something']"
answer for,He will have to answer for the detailed handling of the operation.,"['to agree to be responsible for something', 'to be responsible for a lot of bad things that have happened', 'used for emphasizing that you cannot say what someone else will do or think about something']"
answer to,a small boy answering to the name of Andrew,"['if an animal answers to the name of something, it comes to you when you call it this name', 'to have a particular name', 'to have to explain to someone why you did something']"
answer to,I answer to no one except the president.,"['if an animal answers to the name of something, it comes to you when you call it this name', 'to have a particular name', 'to have to explain to someone why you did something']"
arrive at,The two studies arrive at very different conclusions.,"['to reach a result, decision, or solution to a problem']"
arrive at,How did they arrive at that figure?,"['to reach a result, decision, or solution to a problem']"
ask after,I met Bob and he asked after you.,['to ask for news about someone']
ask after,`I thought you might be calling to ask after that guy you sent us.,['to ask for news about someone']
ask around,"I asked around, but nobody had seen him for days.",['to ask several people for information or advice']
ask around,"It may only be known by those already working in your chosen field, so ask around.",['to ask several people for information or advice']
ask for,Anyone who drives while they’re drunk is just asking for it.,"['to behave in a way that makes it likely that a particular unpleasant thing will happen to you', 'to say that you want someone to come and speak to you', 'to speak or write to someone because you want them to give you something', 'used for emphasizing that something is so good that nothing could be better']"
ask for,He’s always reluctant to ask for anyone’s help.,"['to behave in a way that makes it likely that a particular unpleasant thing will happen to you', 'to say that you want someone to come and speak to you', 'to speak or write to someone because you want them to give you something', 'used for emphasizing that something is so good that nothing could be better']"
ask out,Let her breathe the air outside of Sanctuary for a time and then ask her the same question.,"['to invite someone to go with you to a cinema, restaurant etc because you want to start a romantic or sexual relationship with them']"
ask out,"We're friends, so I'm going to keep my temper and ask you what you're suggesting.","['to invite someone to go with you to a cinema, restaurant etc because you want to start a romantic or sexual relationship with them']"
associate with,"While she was in Paris, she associated with many well-known artists.","['to say publicly that you support someone or agree with something', 'to spend time with someone']"
attend to,He likes work that requires him to attend to a lot of detail.,"['to deal with something or someone', 'to serve a customer in a shop, restaurant etc']"
attend to,We still have a number of other matters to attend to.,"['to deal with something or someone', 'to serve a customer in a shop, restaurant etc']"
average out,"Total contributions average out at over £1,000 a week.","['to calculate the average of a set of numbers or amounts', 'to have a particular number or amount as an average']"
awaken to,Someone needed to awaken Gavin to the fact that his marriage was in danger.,"['to begin to notice something, or to make someone begin to notice something, especially danger']"
awaken to,It took them many years to awaken to the dangers they were facing.,"['to begin to notice something, or to make someone begin to notice something, especially danger']"
back away,The photo showed a woman backing away from a man with a gun.,"['to gradually become less involved in something', 'to move away backwards from someone, for example because you are afraid']"
back away,The World Bank is backing away from big infrastructure projects.,"['to gradually become less involved in something', 'to move away backwards from someone, for example because you are afraid']"
back down,How do we get him back down there?,"['to stop asking for something, or to stop saying that you will do something, because a lot of people oppose you']"
back down,We will not back down on the decision to strike.,"['to stop asking for something, or to stop saying that you will do something, because a lot of people oppose you']"
back off,"Back off, will you? I’ll tell you when I’m ready!","['to move backwards in order to get further away from something', 'to stop criticizing someone or telling them what to do']"
back off,Everyone back off and let the doctor through.,"['to move backwards in order to get further away from something', 'to stop criticizing someone or telling them what to do']"
back onto,a field that backs onto a railway line,"['if a building, garden etc backs onto a place, that place is directly behind it']"
back out,"He brushed it back out of his eyes, intrigued enough to say: `Yes, once.",['to decide not to do something you agreed to do']
back out,"He doesn't want her back out of love, or out of his desperation to make a good album.",['to decide not to do something you agreed to do']
back out of,We’re hoping that no one will back out of the deal.,['to decide not to do something you agreed to do']
back out of,I promised to help and I’m not backing out now.,['to decide not to do something you agreed to do']
back up,I’ll back the car up the driveway.,"['if a system backs up, or if it is backed up, it has slowed down or stopped working because there is too much of something for it to deal with', 'if a toilet, sink, or drain backs up, or if it is backed up, water cannot flow through it because something is blocking it', 'if traffic backs up, or if it is backed up, the vehicles are in a long line and waiting to continue moving', 'to give support to someone by telling other people that you agree with them', 'to make a car go backwards', 'to make a copy of information on your computer', 'to move backwards a short distance', 'to show that an explanation or belief is probably true', 'used for telling someone to return to something that was said earlier']"
back up,All the evidence backs up her story.,"['if a system backs up, or if it is backed up, it has slowed down or stopped working because there is too much of something for it to deal with', 'if a toilet, sink, or drain backs up, or if it is backed up, water cannot flow through it because something is blocking it', 'if traffic backs up, or if it is backed up, the vehicles are in a long line and waiting to continue moving', 'to give support to someone by telling other people that you agree with them', 'to make a car go backwards', 'to make a copy of information on your computer', 'to move backwards a short distance', 'to show that an explanation or belief is probably true', 'used for telling someone to return to something that was said earlier']"
bag up,They’ll only accept coins that have been bagged up.,['same as bag']
bail out,Investors bailed out of high-tech stocks as prices plunged.,"['to empty water from a boat using a small container', 'to escape from a plane by parachute', 'to give money to a court when someone is allowed to stay out of prison while they wait for their trial', 'to help a person or organization that is having problems, especially financial problems', 'to leave a project, situation, or relationship, especially when it becomes difficult']"
bail out,The government has already bailed the project out once before.,"['to empty water from a boat using a small container', 'to escape from a plane by parachute', 'to give money to a court when someone is allowed to stay out of prison while they wait for their trial', 'to help a person or organization that is having problems, especially financial problems', 'to leave a project, situation, or relationship, especially when it becomes difficult']"
bail out of,Investors bailed out of high-tech stocks as prices plunged.,"['to empty water from a boat using a small container', 'to escape from a plane by parachute', 'to give money to a court when someone is allowed to stay out of prison while they wait for their trial', 'to help a person or organization that is having problems, especially financial problems', 'to leave a project, situation, or relationship, especially when it becomes difficult']"
bail out of,My father got a lawyer and bailed me out.,"['to empty water from a boat using a small container', 'to escape from a plane by parachute', 'to give money to a court when someone is allowed to stay out of prison while they wait for their trial', 'to help a person or organization that is having problems, especially financial problems', 'to leave a project, situation, or relationship, especially when it becomes difficult']"
balance out,The tangy fruit balances out the creaminess of the sauce.,['same as balance']
balance out,Don’t worry – it’ll all balance out in the end.,['same as balance']
balance up,We need to balance up inequality of treatment between men and women.,['to make two different things equal in amount or value']
band together,But ugly people do not band together: there is no conscious group formation around the idea of ugly.,['to come together as a group in order to achieve something']
band together,Their threat: that they will band together and protect themselves from Chinese imports with tariffs and other measures.,['to come together as a group in order to achieve something']
bang on,Is she still banging on about the neighbours?,['to talk about something for a long time in a boring and annoying way']
bang on,My look is set to be bang on trend.,['to talk about something for a long time in a boring and annoying way']
bang on about,Is she still banging on about the neighbours?,['to talk about something for a long time in a boring and annoying way']
bang up,He spent seven years banged up in a prison cell.,"['to damage something such as a vehicle', 'to put someone in prison']"
bang up,How did your truck get all banged up?,"['to damage something such as a vehicle', 'to put someone in prison']"
bank in,"The dogs have been vaccinated now, and we have banked in the money to the vet directly.",['to pay money into a bank']
bank on,She is upbeat about the polls and is banking on an unpopular president and an unpopular war.,['to depend on something happening or on someone doing something']
bank on,They’re banking on him to save the match.,['to depend on something happening or on someone doing something']
bank up,Soil was banked up against the wall.,"['to make something into a pile', 'to put a lot of coal onto a fire so that it will burn slowly and for a long time']"
bank up,"Before going to bed, she banked up the fire.","['to make something into a pile', 'to put a lot of coal onto a fire so that it will burn slowly and for a long time']"
bargain on,She’s bargaining on me changing my mind.,"['to expect something to happen, often because something else depends on it']"
barge in,The kids just barge in without knocking.,"['to enter a room suddenly and noisily, usually interrupting someone in a rude way']"
barge in,He just barged in on us in the middle of a meeting.,"['to enter a room suddenly and noisily, usually interrupting someone in a rude way']"
base on,He bases his designs on Roman mosaics.,"['to use particular ideas or facts to make a decision, do a calculation, or develop a theory', 'to use something as a model for a film, piece of writing, or work of art']"
base on,The prosecution’s case is based largely on evidence from ex-members of the gang.,"['to use particular ideas or facts to make a decision, do a calculation, or develop a theory', 'to use something as a model for a film, piece of writing, or work of art']"
bash away at,She’s still bashing away at her last chapter.,['to continue to work hard on something']
bash on,I’d better bash on with this – I’ll see you later.,['to continue to do something when you would prefer to stop']
batter down,Police battered down her door and found the girl.,['to break a door or gate in order to get through it']
batter down,Some escaped after a bouncer battered down a partition wall.,['to break a door or gate in order to get through it']
bear down,I can't have a wobbly surface when I'm trying to bear down.,"['to move quickly towards someone in a determined and threatening way', 'to push or press downwards']"
bear down,I could see a police car bearing down on us.,"['to move quickly towards someone in a determined and threatening way', 'to push or press downwards']"
bear down on,I could see a police car bearing down on us.,"['to move quickly towards someone in a determined and threatening way', 'to push or press downwards']"
bear down on,It’s a natural instinct for a woman giving birth to bear down.,"['to move quickly towards someone in a determined and threatening way', 'to push or press downwards']"
bear on,Do you have any information bearing on his disappearance?,['to be connected with something or to influence it']
bear out,I always said – and Rick will bear me out – that this wouldn’t work.,['to show that something is true or that someone is telling the truth']
bear out,Scientific evidence bears out the claim that stress and disease are linked.,['to show that something is true or that someone is telling the truth']
bear up,A few nights ago during the course of a dinner I got an insight into how he is bearing up.,['to behave in a brave way in a very sad or difficult situation']
bear up,"Asked how he was bearing up under the mounting questions about his economic competence, he was dismissive of the sceptics.",['to behave in a brave way in a very sad or difficult situation']
bear up under,Let’s see how he bears up under the pressure.,['to behave in a brave way in a very sad or difficult situation']
bear with,But bear with us here.,['used as a polite way of asking someone to be patient while you do or finish something']
bear with,"I know it's boring, but bear with me for a bit.",['used as a polite way of asking someone to be patient while you do or finish something']
beat down,"As the sun beat down, a beach ball was launched along the terrace.","['if the rain beats down, it rains very hard', 'if the sun beats down, it shines very brightly making the weather very hot', 'to persuade someone to sell you something at a lower price than their first offer']"
beat down,I could feel the sun beating down on my head.,"['if the rain beats down, it rains very hard', 'if the sun beats down, it shines very brightly making the weather very hot', 'to persuade someone to sell you something at a lower price than their first offer']"
beat off,He had to beat the dogs off with a stick.,"['to prevent someone from physically attacking you by hitting them with your hands or with an object', 'to succeed in winning or gaining something from an opponent']"
beat off,Virgin Airlines must beat off stiff competition to win the contract.,"['to prevent someone from physically attacking you by hitting them with your hands or with an object', 'to succeed in winning or gaining something from an opponent']"
beat on,"According to the witness, the police ran up and started beating on him.",['to hurt someone by hitting them a lot of times']
beat out,He claims that the confession was beaten out of him.,"['to make a pattern of sounds by hitting an instrument or other object', 'to make someone tell you something by hitting them', 'to stop a fire from burning by hitting it with something', 'to succeed in winning or gaining something that someone else wants']"
beat out,drummers beating out a rhythm,"['to make a pattern of sounds by hitting an instrument or other object', 'to make someone tell you something by hitting them', 'to stop a fire from burning by hitting it with something', 'to succeed in winning or gaining something that someone else wants']"
beat up,"Kenneth would send him and he'd come like a beat-up, punch-drunk fighter; useless and straight into the trap.","['to blame or criticize yourself or someone else', 'to hurt someone by hitting or kicking them many times']"
beat up,"He and his henchman kidnapped and beat up a borrower who had ended up owing £250,000 in interest alone.","['to blame or criticize yourself or someone else', 'to hurt someone by hitting or kicking them many times']"
beat up on,I’m not here to beat up on single parents.,['same as beat up']
beat up on,He and his brother are always beating up on each other.,['same as beat up']
beaver away,He was beavering away at his homework until after midnight.,"['if you beaver away at something, you work very hard at it']"
