phrasal_verb,example,description
dream up,"Before the end, the leaders dreamed up more and more fantastical punishments for those who exhibited doubts.","['to think of a new idea or plan, especially one that is silly or unusual']"
dream up,Not sure if he'll find a new project dreamt up by his old writing partner as funny.,"['to think of a new idea or plan, especially one that is silly or unusual']"
dredge up,Details of his previous affairs were dredged up by the media.,"['to manage to remember something that you learned or knew long ago', 'to tell people about something that someone did in the past that they would prefer to keep secret']"
dredge up,`I'm not looking to dredge up a list of past boy friends.,"['to manage to remember something that you learned or knew long ago', 'to tell people about something that someone did in the past that they would prefer to keep secret']"
dress down,Anyone caught not wearing a seatbelt in a car or a taxi can expect a dressing down from the chairman himself.,"['to speak in an angry way to someone who has done something wrong', 'to wear clothes that are more informal than the clothes that you usually wear']"
dress down,The controversial centreback has already received at least one dressing down from his manager for overdoing the theatrics this season.,"['to speak in an angry way to someone who has done something wrong', 'to wear clothes that are more informal than the clothes that you usually wear']"
dress up,They had dressed up as princes and princesses.,"['to make something seem more impressive than it really is', 'to put clothes on someone so that they look like someone else, for fun', 'to put on clothes that are more formal than the clothes you usually wear', 'to put on clothes that make you look like someone else, for fun']"
dress up,"And I told her, because when you dress up, and make up, and act, you're somebody else.","['to make something seem more impressive than it really is', 'to put clothes on someone so that they look like someone else, for fun', 'to put on clothes that are more formal than the clothes you usually wear', 'to put on clothes that make you look like someone else, for fun']"
drift off,I was just drifting off when the door slammed.,['to start to sleep']
drift off,Pop this calming eye mask on and you'll drift off in minutes.,['to start to sleep']
drill into,If you do something you should never do it half-heartedly. My parents drilled that into us when we were young.,['to make someone learn or understand something by telling them about it many times']
drink down,She made a face but drank the medicine down.,"['to drink all of something, especially quickly']"
drink in,They might know nothing about riding beasts; but they knew by now how to eat and drink in the desert.,['to experience something with great enjoyment']
drink in,Sit out on the terrace and drink in the stunning view.,['to experience something with great enjoyment']
drink to,I hope you will drink to our good journey.,"['to wish for health, happiness, or success for someone or something, then lift your glass and drink from it', 'used for saying that you strongly agree with what someone has said, or strongly hope that it is true']"
drink to,We will now drink a toast to the bride and groom.,"['to wish for health, happiness, or success for someone or something, then lift your glass and drink from it', 'used for saying that you strongly agree with what someone has said, or strongly hope that it is true']"
drink up,I gave the cat some milk and she drank it all up.,['to drink all of your drink']
drink up,"Drink up, everyone, it’s time to go.",['to drink all of your drink']
drive at,I can see what you’re driving at.,['what someone is really trying to say']
drive away,Being constantly on the attack can drive away the very people who need to be reached with the gospel.,['to make someone stop wanting something or stop wanting to be with someone']
drive away,"Girls begin to approach them, and are soon driven away in cars by the older men.",['to make someone stop wanting something or stop wanting to be with someone']
drive down,Fierce competition among restaurants has driven down prices.,['to make a price or amount fall to a lower level']
drive off,My father just drove off as if he was going down to the village shop.,"['if a vehicle or driver drives off, the vehicle starts moving and leaves', 'to force someone to go away, especially when they are attacking or threatening you']"
drive off,The answer was that he drove off with the fuel pump attached.,"['if a vehicle or driver drives off, the vehicle starts moving and leaves', 'to force someone to go away, especially when they are attacking or threatening you']"
drive out,Government forces have driven the rebels out of the eastern district.,['to force someone or something to leave a place']
drive up,The government’s policies are driving up interest rates.,"['if a vehicle or driver drives up, the vehicle moves near to a person or place and stops', 'to make a price or amount rise to a higher level']"
drive up,A huge Rolls Royce drove up.,"['if a vehicle or driver drives up, the vehicle moves near to a person or place and stops', 'to make a price or amount rise to a higher level']"
drop away,"A cliff rose on her right side, ground dropped away on the left.","['same as drop', 'to become weaker or smaller in amount']"
drop away,"As we round the first rock face and the ground drops away to the pass far below, adrenalin surges into my veins.","['same as drop', 'to become weaker or smaller in amount']"
drop back,Alex dropped back to let me pass.,"['same as drop', 'to move into a lower position in a race or competition', 'to move more slowly than other people so that you are behind them']"
drop back,Economic growth will drop back to 3% this year.,"['same as drop', 'to move into a lower position in a race or competition', 'to move more slowly than other people so that you are behind them']"
drop behind,Mary dropped behind to walk with Sam.,['same as drop back']
drop behind,Jensen has dropped behind into last place.,['same as drop back']
drop by,Why don’t you drop by for coffee some time?,['to make a short visit somewhere']
drop in,"They provide advice and support, organise trips and courses and run youth drop-in centres.",['to make a short visit somewhere']
drop in,"Maybe she'd drop in on Annie Cabbot, the only decent copper among them.",['to make a short visit somewhere']
drop off,"She got no drop-off in membership moving the group to the house, and being under siege brought out the best in them.","['same as drop', 'same as drop away', 'to start to sleep']"
drop off,Can you drop the kids off at school this morning?,"['same as drop', 'same as drop away', 'to start to sleep']"
drop out,"His father and grandfather were hit hard, and Dad had to drop out of school.","['to decide not to have an ordinary job or life because you do not want to be part of society', 'to leave something such as an activity, school, or competition before you have finished what you intended to do']"
drop out,Too many students drop out of college after only one year.,"['to decide not to have an ordinary job or life because you do not want to be part of society', 'to leave something such as an activity, school, or competition before you have finished what you intended to do']"
drop round,I thought I’d drop round to see how you are.,['same as drop']
drug up,Doctors can’t just drug people up for their own convenience.,['to give someone a lot of drugs or medicine with the result that they cannot behave normally']
drum into,"Education is something he will always give advice about, and the importance of it is something he has drummed into all of us.",['to make someone learn or understand something by repeating it many times']
drum into,My Quaker grandmother had a maxim that was drummed into me: business before pleasure.,['to make someone learn or understand something by repeating it many times']
drum out,"Right, now tip it forward and I'll manoeuvre the drum out of the car.",['to force someone to leave an organization because they have done something bad']
drum up,"I had to pull myself together, show no sign of weakness, drum up some aggression to protect myself.",['to try to make people support you or buy something from you']
drum up,We should probably see what sort of a deal we can drum up with one of the mags.,['to try to make people support you or buy something from you']
dry off,Wash the salad and leave it to dry off.,"['if something dries off, or if you dry it off, all the water dries or is wiped from its surface']"
dry off,He got out of the shower and dried himself off.,"['if something dries off, or if you dry it off, all the water dries or is wiped from its surface']"
dry out,"Until they got to England, it looked like he was going to have to dry out, a truly nauseating prospect.","['if something dries out or is dried out, some or all the water comes out of it', 'to give up drinking alcohol, or to help someone do this, especially by getting medical treatment']"
dry out,"`I say let's go hack to the cabin, dry out, have a cup of coffee, and regroup.","['if something dries out or is dried out, some or all the water comes out of it', 'to give up drinking alcohol, or to help someone do this, especially by getting medical treatment']"
dry up,Output of the hormone dries up completely in sufferers and they have to inject it themselves two or three times a day.,"['if something dries up or is dried up, all the water comes out of it', 'same as dry', 'to stop being available', 'to stop talking because you do not know what to say']"
dry up,Sympathy has not completely dried up for the detainees.,"['if something dries up or is dried up, all the water comes out of it', 'same as dry', 'to stop being available', 'to stop talking because you do not know what to say']"
dub in,The sound of the train was dubbed in afterwards.,"['to change part of the original sound of a recording, especially a film, by adding new sound to it']"
dub out,They dubbed the background noise out.,"['to remove part of the original sound from a recording, especially a film']"
dub over,They dubbed over the American dialogue and replaced it with Russian.,"['to replace the original soundtrack of a film with one in a different language, so that the actors seem to be speaking the other language']"
duck out,It is time he ducked out of the limelight a little and let his rugby do his talking.,"['to leave a place, especially in a way that is not noticed by other people']"
duck out,You would have thought that a certain event at The Emirates three days earlier was a lesson for those who duck out early.,"['to leave a place, especially in a way that is not noticed by other people']"
duff up,"She was trying to cool it and reason with her black friends, but they shoved her aside and shaped up like they were going to duff up the Dl.",['to hurt someone by hitting or kicking them many times']
dust down,You have to learn to just dust down yourself and try again.,"['to quickly try something again or continue to do what you were doing after a problem or failure, without getting upset', 'to wipe dust or dirt off the surface of something']"
dust down,"She came in from the snow, dusting down her jacket.","['to quickly try something again or continue to do what you were doing after a problem or failure, without getting upset', 'to wipe dust or dirt off the surface of something']"
dust off,Dust off your dancing shoes as we have the competition for you.,"['to get something ready to use that you have not used for a long time', 'to wipe dust or dirt off the surface of something', 'to wipe dust or dirt off your clothes']"
dust off,It's the season to dust off the cobwebs in your company.,"['to get something ready to use that you have not used for a long time', 'to wipe dust or dirt off the surface of something', 'to wipe dust or dirt off your clothes']"
dwell on,He tends to dwell on the negative aspects of his performance.,['to spend a lot of time thinking or talking about something unpleasant']
dwell upon,He tends to dwell on the negative aspects of his performance.,['to spend a lot of time thinking or talking about something unpleasant']
ease off,"If she doesn’t ease off at work, she’ll make herself ill.","['if something unpleasant or annoying eases off, it becomes less unpleasant or annoying', 'to give something less effort or energy, especially when you have been working very hard', 'to go more slowly, especially when you are driving or running fast']"
ease off,The pain should ease off after a couple of hours.,"['if something unpleasant or annoying eases off, it becomes less unpleasant or annoying', 'to give something less effort or energy, especially when you have been working very hard', 'to go more slowly, especially when you are driving or running fast']"
ease out,Senior party sources say Liddell will be eased out during the next few weeks.,['to make someone leave a job or position without saying anything publicly']
ease up,Judges have been advised to ease up on jail sentences.,"['same as ease off', 'to become less severe towards someone']"
ease up,They waited nearly four hours for the storm to ease up.,"['same as ease off', 'to become less severe towards someone']"
eat away,"After nearly three years of exhaustion and emotional numbness, I decide to confront the thing eating away at me and the family.",['to gradually destroy something']
eat away,That sort of thing eats away at your belief.,['to gradually destroy something']
eat away at,You could see that jealousy was eating away at her.,['to make someone feel more and more unhappy or worried']
eat into,"The river had eaten into the bank, and part of it had collapsed.","['if an activity or cost eats into your time or money, it uses more of it than you intended', 'same as eat away']"
eat out,People are spending more on eating out.,['to have a meal in a restaurant instead of at home']
eat up,Within a week or two of my going back she'll be telling me to eat up my nice greens.,"['to eat all of something', 'to feel a negative emotion so strongly that it is difficult to think about anything else', 'to like something so much that you want to hear or see more', 'to travel a particular distance easily and steadily', 'to use large amounts of your available time or money']"
eat up,"Eat up, and we’ll go for a walk.","['to eat all of something', 'to feel a negative emotion so strongly that it is difficult to think about anything else', 'to like something so much that you want to hear or see more', 'to travel a particular distance easily and steadily', 'to use large amounts of your available time or money']"
edge out,Eileen Petersen edged out Victor Frazer by 27 votes.,['to beat someone in something such as a competition or election by a small amount']
edit out,"""Well, you'd better edit out the parts that show Mia's face.","['to remove parts of a film, television, or radio programme that are not wanted before it is shown or broadcast']"
egg on,He’d never have stolen it if she hadn’t egged him on.,['to encourage someone to do something that they should not do']
eke out,"Gwen John lived in utter poverty in France, modelling for a few coppers to eke out, and she had a great affair with Rodin.","['to get just enough money or food to be able to continue to exist', 'to make something such as money or food last as long as possible']"
eke out,"She had spat out her labia and now attempted to call them by name, to eke out a little mercy.","['to get just enough money or food to be able to continue to exist', 'to make something such as money or food last as long as possible']"
embark on,"After leaving college, Lucy embarked on an acting career.","['to start a journey by ship', 'to start a new project or activity, usually one that will be difficult and will take time']"
embark on,The new government embarked upon an energetic legislative programme.,"['to start a journey by ship', 'to start a new project or activity, usually one that will be difficult and will take time']"
embark upon,"After leaving college, Lucy embarked on an acting career.","['to start a journey by ship', 'to start a new project or activity, usually one that will be difficult and will take time']"
embark upon,The new government embarked upon an energetic legislative programme.,"['to start a journey by ship', 'to start a new project or activity, usually one that will be difficult and will take time']"
empty out,He emptied his clothes out of the drawers.,['same as empty']
empty out,She lifted the bag and emptied the contents out onto the bed.,['same as empty']
end in,But in the end my baby 's body swelled and he went into heart failure and succumbed.,"['if a situation ends in tears, people involved in it become disappointed or angry', 'to have something as a final result']"
end in,His attempt to persuade the boy ended in failure.,"['if a situation ends in tears, people involved in it become disappointed or angry', 'to have something as a final result']"
end up,I ended up spending the night in the airport.,['to be in a particular place or state after doing something or because of doing it']
end up,It could end up costing her a small fortune in the long run.,['to be in a particular place or state after doing something or because of doing it']
end with,Why did you end your essay with a quotation from Shakespeare?,"['to add something as the final part of something else', 'to have something as the final part']"
end with,The festival ended with fireworks.,"['to add something as the final part of something else', 'to have something as the final part']"
endow with,The General’s supporters endow him with an almost godlike status.,"['to give a particular quality to something, or to say that something has a particular quality', 'to have something such as a good ability or quality']"
endow with,She is endowed with both brains and beauty.,"['to give a particular quality to something, or to say that something has a particular quality', 'to have something such as a good ability or quality']"
engage in,He has engaged in a dispute with his former business partner.,"['to start having a conversation with someone', 'to take part in a particular activity, especially one that involves competing with other people or talking to them']"
engage with,She is accused of failing to engage with the problems of her staff.,"['to make an effort to understand and deal with someone or something', 'to start to fight an enemy in battle']"
enlarge on,He refused to enlarge upon his reasons for leaving his job.,['to give more information about something that you have already mentioned']
enter into,The picture will also be entered into our monthly competition for a chance to win a holiday to Mexico with Thomson.,"['to agree to be part of an official agreement or contract', 'to be an important aspect of a situation', 'to behave in the enthusiastic way that people expect in a particular situation, for example in a game or at a party', 'to start to take part in an official discussion or other formal activity']"
enter into,"In 1986, the organization entered into an agreement with a private firm to operate the security system.","['to agree to be part of an official agreement or contract', 'to be an important aspect of a situation', 'to behave in the enthusiastic way that people expect in a particular situation, for example in a game or at a party', 'to start to take part in an official discussion or other formal activity']"
even out,"On a clear day you could see the house from far away, even out to sea.","['if things even out, or if you even them out, they show fewer or smaller changes or differences', 'to share or divide something equally, or to be shared or divided equally']"
even out,We would like to be able to even out the workload more fairly.,"['if things even out, or if you even them out, they show fewer or smaller changes or differences', 'to share or divide something equally, or to be shared or divided equally']"
even up,"Lee, the truth of the matter is you're simply too young to let two or three years, even up here, wreck your life.",['to make something fairer or more equal']
even up,"`But I'm afraid of being overheard, no matter where we go in the dun, even up here.",['to make something fairer or more equal']
explain away,He has lied to try and explain away his barbaric crime.,"['to tell someone about something in a way that makes them think it is unimportant, so that they do not ask questions about it']"
explain away,She made up stories to explain away the missing money.,"['to tell someone about something in a way that makes them think it is unimportant, so that they do not ask questions about it']"
eye up,New buyers are also eyeing up homes farther down the property ladder.,['to look at someone in a way that shows you are sexually attracted to them']
face about,The soldiers faced about and started marching south.,['to turn and face in the opposite direction']
face down,"He lay face down in the pillows where he had collapsed, fully clothed.",['to appear strong and confident when someone is threatening or criticizing you']
face down,They showed they could face down the opposition.,['to appear strong and confident when someone is threatening or criticizing you']
face off,The teams face off at 3 o’clock.,"['if people or groups face off, they compete or fight with each other', 'to begin a game of ice hockey']"
face off,Soldiers and protesters faced off during riots.,"['if people or groups face off, they compete or fight with each other', 'to begin a game of ice hockey']"
face up to,"When people begin to accept and face up to what has happened, they are enabled to handle it and grow through the experience.",['same as face']
face up to,He was the only one who faced up to the problem.,['same as face']
factor in,"In the doctor's opinion, this relationship was a significant contributory factor in Moira's commitment to staying off heroin.",['to include a particular amount or factor when you calculate something']
factor in,"We weren't supposed to know about the radar or the sonar buoys, so that was already a factor in our favour.",['to include a particular amount or factor when you calculate something']
fade away,Her footsteps faded away down the staircase.,"['same as fade', 'to disappear slowly']"
fade away,If you don’t start eating properly you’re going to fade away.,"['same as fade', 'to disappear slowly']"
fade in,The DJ faded in another record.,"['if a sound or picture fades in, or if you fade it in, it gradually becomes louder or clearer']"
fade out,`I don't know wha'chu gonna do when we gotta do a sudden fade-out.,"['if a sound or picture fades out, or if you fade it out, it gradually disappears']"
fade out,The voice on the radio faded out.,"['if a sound or picture fades out, or if you fade it out, it gradually disappears']"
fall about,"Jesus, just'cos I don't fall about all over you, you think I'm in a bad mood.","['if you fall about or fall about laughing, you laugh a lot at something']"
fall about,"Still, he made all of us, including Art, fall about laughing.","['if you fall about or fall about laughing, you laugh a lot at something']"
fall apart,"He knew from experience about the frost that comes after sorrow, binding together what else must fall apart.","['if something such as an organization, agreement, or relationship falls apart, it no longer continues', 'to break because of being old or badly made', 'to lose control of your emotions and become unable to deal with a difficult situation']"
fall apart,I guess it was like that for you when your company started to fall apart.,"['if something such as an organization, agreement, or relationship falls apart, it no longer continues', 'to break because of being old or badly made', 'to lose control of your emotions and become unable to deal with a difficult situation']"
fall away,"I inched away from her, and she let her hand fall away from my leg.","['if land falls away, it slopes down suddenly from a particular point', 'if something falls away, it breaks off from the thing it was fixed to', 'if something such as a sound or feeling falls away, it becomes weaker and disappears', 'to become smaller or lower in amount, level, value etc']"
fall away,Plaster was falling away from the walls.,"['if land falls away, it slopes down suddenly from a particular point', 'if something falls away, it breaks off from the thing it was fixed to', 'if something such as a sound or feeling falls away, it becomes weaker and disappears', 'to become smaller or lower in amount, level, value etc']"
fall back,Oliver and Sara fell back and started talking.,"['to become smaller or lower in amount, level, value etc', 'to move so that you are behind someone or something']"
fall back,Profits fell back slightly this month.,"['to become smaller or lower in amount, level, value etc', 'to move so that you are behind someone or something']"
fall back on,"Where I need practical advice and have only theoretical data to fall back on, I won't be ashamed to ask for your help.",['to use or do something else after other things have failed']
fall back on,She always has her teaching experience to fall back on.,['to use or do something else after other things have failed']
fall behind,After five miles Tara was tired and started to fall behind.,"['to fail to do something or pay something at the time that you should', 'to make less progress or be less successful than other people who are doing a similar job or activity', 'to move more slowly than other people so that you are behind them']"
fall behind,"And she won't fall behind, because if she does, she'll be taught how to keep up!","['to fail to do something or pay something at the time that you should', 'to make less progress or be less successful than other people who are doing a similar job or activity', 'to move more slowly than other people so that you are behind them']"
