phrasal_verb,example,description
scare away,The city’s high murder rate has scared away tourists.,"['to make someone feel so frightened or worried that they do not do something that they had planned to do', 'to make someone so frightened that they run away']"
scare into,Many people have been scared into buying organic food.,['to make someone feel so worried or frightened that they do something']
scare off,The city’s high murder rate has scared away tourists.,"['to make someone feel so frightened or worried that they do not do something that they had planned to do', 'to make someone so frightened that they run away']"
scare off,The attacker was scared away when the woman started to scream.,"['to make someone feel so frightened or worried that they do not do something that they had planned to do', 'to make someone so frightened that they run away']"
scare up,I put down the phone and then headed out to the kitchen to see if there was anything I could scare up for dinner.,['to make something using the few things that are available']
scoop up,People arriving early scooped up fantastic bargains.,"['to get something, usually something good or valuable, before someone else gets it', 'to lift something or someone quickly with your hands or arms']"
scoop up,Ralph scooped up a handful of dirt.,"['to get something, usually something good or valuable, before someone else gets it', 'to lift something or someone quickly with your hands or arms']"
scoot over,"If I scoot over a little, there’s room for you.","['if someone sitting down scoots over, they move to a different position, for example to make space for someone else to sit down']"
score off,Why does she constantly try to score off her sister?,['to gain an advantage over someone']
score out,Score through the guests’ names as they arrive.,['to draw a line through written words']
scout out,He asked her to scout out job opportunities for him while she was in Dallas.,['to try to find something']
scrape by,She just manages to scrape by on her teacher’s salary.,"['to have enough money to pay for the things that you really need in order to live, but no more']"
scrape in,The new candidate scraped in by a tiny one-vote margin.,['to achieve a position by a very small number of votes or points']
scrape into,The team scraped into the final with a 2–1 win.,['to achieve a position by a very small number of votes or points']
scrape through,I think he’ll just scrape through the entrance exam.,"['to succeed in doing something, but not in a very impressive way']"
scrape together,They have trouble even scraping together their rent.,"['to succeed in getting enough of something, especially money, by making a lot of effort']"
scrape up,They have trouble even scraping together their rent.,"['to succeed in getting enough of something, especially money, by making a lot of effort']"
screen off,Part of the hall had been screened off as a waiting room.,"['to separate one part of a room from another, for example to make it more private']"
screen out,Cycle masks are designed to screen out pollutants.,"['to prevent something that is dangerous or unsuitable from coming in', 'to refuse to accept someone who is not suitable for something, for example a job']"
screw over,I decided to screw him over by stealing his test and changing all the answers.,['to deliberately put someone in an unfavorable situation']
screw up,Divorce doesn’t have to screw your children up.,"['if you screw up your eyes, you close them tightly', 'if you screw up your face, you pull your forehead down and push your mouth and nose up, usually to show that you dislike something', 'to make a serious mistake, or to spoil something, especially a situation', 'to make someone feel so upset or confused that their whole personality is affected, often permanently', 'to make something into a smaller shape by squeezing or twisting it', 'to prepare mentally for doing something difficult']"
screw up,He made a bad decision that screwed up his entire life.,"['if you screw up your eyes, you close them tightly', 'if you screw up your face, you pull your forehead down and push your mouth and nose up, usually to show that you dislike something', 'to make a serious mistake, or to spoil something, especially a situation', 'to make someone feel so upset or confused that their whole personality is affected, often permanently', 'to make something into a smaller shape by squeezing or twisting it', 'to prepare mentally for doing something difficult']"
scrub out,We finished scrubbing out the inside of all the cupboards.,['to clean the inside of something thoroughly']
scrub up,"He scrubs up well, don't you think?","['if a doctor or nurse scrubs up, they wash their hands and arms thoroughly before doing a medical operation', 'if someone scrubs up well, they look good when they have made an effort when getting ready to go out']"
seal in,The tomatoes are then heated to seal in the juices.,"['to prevent the flavour, smell, or juice of a food from getting out']"
seal off,Police sealed off the area so that the investigations could begin.,['to prevent people from entering an area or a building']
seal off,"He just takes another identity and moves on, knowing the real so-and-so-Eric Shivers, Alan Palmer-will seal off the trail.",['to prevent people from entering an area or a building']
seal up,The furniture is covered and the doors are sealed up with tape.,['same as seal']
search out,People need to search out the treatments that work best for them.,['to work hard in order to find something']
section off,Section off the room before you start.,['to separate something into different parts or areas']
see about,We must have seen about 40 plans of new stadiums for Wimbledon.,"['to deal with or organize something', 'used for saying that you are not able to decide now', 'used for saying that you are not going to let someone do something that they are intending to do']"
see about,He fought back tears as he said: 'I saw about half of the cliff face collapse.,"['to deal with or organize something', 'used for saying that you are not able to decide now', 'used for saying that you are not going to let someone do something that they are intending to do']"
see around,What a beautiful house! I’d love to see around it.,"['to examine a place by walking around it', 'to notice someone often in places that you go to regularly', 'used for saying goodbye to someone when you are not sure when you will meet them again']"
see around,"I’ve never actually met her, but I’ve seen her around.","['to examine a place by walking around it', 'to notice someone often in places that you go to regularly', 'used for saying goodbye to someone when you are not sure when you will meet them again']"
see in,I thought I saw a glimmer of sympathy in Ben’s eyes.,"['to celebrate the beginning of a year by staying awake until midnight', 'to not understand why one person finds another person attractive or likes them', 'to recognize a particular quality in someone or something', 'to see the inside of a building through a window or an open door', 'to welcome a visitor to a building and take them to where they want to go']"
see in,The ambassador waited on the steps to see the visiting dignitaries in.,"['to celebrate the beginning of a year by staying awake until midnight', 'to not understand why one person finds another person attractive or likes them', 'to recognize a particular quality in someone or something', 'to see the inside of a building through a window or an open door', 'to welcome a visitor to a building and take them to where they want to go']"
see off,Anne saw Terry off at the station.,"['to deal successfully with someone or something, especially by defeating them easily', 'to go somewhere such as a station or airport with someone in order to say goodbye to them', 'to make someone go away or leave a place, especially by chasing them']"
see off,"He'd see off a few of your chaps, too, before they got to him.","['to deal successfully with someone or something, especially by defeating them easily', 'to go somewhere such as a station or airport with someone in order to say goodbye to them', 'to make someone go away or leave a place, especially by chasing them']"
see out,I can see myself out.,"['if something sees you out, it lasts longer than the time you live', 'to celebrate the end of a year', 'to continue to the end of a period of time or an activity', 'to find your way out of a place that you are visiting without any help', 'to go with someone to the door when they are leaving in order to say goodbye to them']"
see out,These are good strong shoes and they’ll probably see me out.,"['if something sees you out, it lasts longer than the time you live', 'to celebrate the end of a year', 'to continue to the end of a period of time or an activity', 'to find your way out of a place that you are visiting without any help', 'to go with someone to the door when they are leaving in order to say goodbye to them']"
see through,He told a court he was given the notes in brown envelopes and see-through plastic bags.,"['to continue doing something until it is finished, especially something unpleasant or difficult', 'to make it possible for someone to continue to the end of something, especially something unpleasant or difficult', 'to realize what someone is really like or what they are really doing and not be tricked by them', 'to recognize that something is not true and not be tricked by it']"
see through,They had enough food to see them through the winter.,"['to continue doing something until it is finished, especially something unpleasant or difficult', 'to make it possible for someone to continue to the end of something, especially something unpleasant or difficult', 'to realize what someone is really like or what they are really doing and not be tricked by them', 'to recognize that something is not true and not be tricked by it']"
see to,I should have seen to it that she was told.,['to deal with or take responsibility for someone or something']
see to,You’d better take her to hospital and get her ankle seen to.,['to deal with or take responsibility for someone or something']
seek out,Not I. For I deem it perilous now for mortal man wilfully to seek out the Elder People.,['to find someone or something by looking for them in a determined way']
seek out,"They did not seek out the rest of us, nor attack our camp; but instead they went with all speed towards Isengard.",['to find someone or something by looking for them in a determined way']
seep away,Their supply of food gradually began to seep away.,['to gradually become weaker or to disappear']
seize on,Companies were quick to seize on the possibilities offered by new technology.,['to use something in an enthusiastic way in order to gain an advantage']
seize on,Carpenter is waiting for an opportunity to seize on something useful.,['to use something in an enthusiastic way in order to gain an advantage']
seize up,"If you don’t add oil, the engine will eventually seize up.",['to suddenly stop moving or working properly']
seize up,Her back seized up painfully after she’d lifted the box.,['to suddenly stop moving or working properly']
sell off,And of course you'll have to sell off the back catalogue,"['to sell something quickly and for a low price, usually because you need money']"
sell off,Most deans don't try to sell off their Cathedral treasures!,"['to sell something quickly and for a low price, usually because you need money']"
sell on,They buy it at a low price and sell it on for a huge profit.,['to sell something after buying it from someone else']
sell out,"But without the reef, people are forced to sell out at rock-bottom prices to pay their debts; a year later Brismand moves in.","['if a shop sells out of something, it sells all that it has so that there is no more available', 'to deliberately sell all the goods in your business, especially because you are closing the business permanently', 'to do something that shows you no longer have the same moral principles that you used to have', 'used about goods']"
sell out,"I went to get some bread, but the shop had sold out.","['if a shop sells out of something, it sells all that it has so that there is no more available', 'to deliberately sell all the goods in your business, especially because you are closing the business permanently', 'to do something that shows you no longer have the same moral principles that you used to have', 'used about goods']"
send away,His solicitor was sent away by the security guards.,['to order someone to leave a place']
send away for,I’ve sent away for details of their holiday packages.,['to write to a person or organization asking them to send something to you']
send back,"If you’re not happy with it, you can always send it back.",['to return something that is not satisfactory']
send down,Eric was sent down for cheating in examinations.,"['to be ordered to leave a university because you have behaved badly', 'to send someone to prison']"
send down,They split it and soon found themselves outside on the street where the sky was undecided over whether to send down snow or sleet.,"['to be ordered to leave a university because you have behaved badly', 'to send someone to prison']"
send for,I think we should send for a doctor.,"['to arrange for something to come to you or be delivered to you', 'to ask for someone to come to you']"
send for,I’ve sent for their latest catalogue.,"['to arrange for something to come to you or be delivered to you', 'to ask for someone to come to you']"
send in,Government forces were sent in to fight the rebellion.,"['to arrange for people or equipment to go to a place', 'to send a letter or document to an organization']"
send in,The Peruvians have assured us they will send in a highly trained security force to control the valley.,"['to arrange for people or equipment to go to a place', 'to send a letter or document to an organization']"
send off,"He had robbed them of a decent send-off, a prolonged farewell.","['to arrange for someone to go somewhere', 'to post something to someone', 'to tell a sports player officially to leave the sports field because they have done something that is not allowed by the rules']"
send off,We’ve sent the children off to the zoo for the afternoon.,"['to arrange for someone to go somewhere', 'to post something to someone', 'to tell a sports player officially to leave the sports field because they have done something that is not allowed by the rules']"
send out,The factory sends out toxic gases into the surrounding countryside.,"['to allow a substance such as smoke or chemicals to escape into the atmosphere', 'to send a lot of copies of the same document to a large number of people', 'to send someone to a place for a particular purpose']"
send out,We sent out a search party to look for the missing climbers.,"['to allow a substance such as smoke or chemicals to escape into the atmosphere', 'to send a lot of copies of the same document to a large number of people', 'to send someone to a place for a particular purpose']"
send out for,I don’t feel like cooking – let’s send out for a pizza.,['to order something and ask for it to be delivered to you']
send up,"Cutter would send up `trial balloons"", what people in the consumer-products business called test-marketing.","['to make someone seem silly by pretending to speak or behave like them', 'to send someone to prison']"
send up,He sends the prime minister up brilliantly.,"['to make someone seem silly by pretending to speak or behave like them', 'to send someone to prison']"
separate out,Two main factors separate out this group of children from the others.,['same as separate']
separate out,The material is processed to separate out the impurities.,['same as separate']
serve out,We want you to serve out your full contract.,"['same as serve', 'to continue doing something until you are officially allowed to stop doing it']"
serve out,Shall I serve out the potatoes?,"['same as serve', 'to continue doing something until you are officially allowed to stop doing it']"
serve up,The teams served up some highly entertaining football this afternoon.,"['same as serve', 'to provide something']"
serve up,Aunt Edie served up a lovely roast leg of lamb for dinner.,"['same as serve', 'to provide something']"
set about,She set about the problem with her usual energy.,"['to begin doing something, especially in a determined or enthusiastic way']"
set about,Donaghue set about resolving the problem of rehousing the victims.,"['to begin doing something, especially in a determined or enthusiastic way']"
set against,Hers is only one story set against thousands of women who will receive a similar screening result this year.,"['to cause two people or groups to fight each other although they were in a friendly relationship before', 'to compare one thing with another', 'to state officially that an amount of money is a cost to your business in order to pay less tax']"
set against,"The epilogue takes place in a kitchen, where a mother stands beside the table surrounded by chairs, one with crutches set against it.","['to cause two people or groups to fight each other although they were in a friendly relationship before', 'to compare one thing with another', 'to state officially that an amount of money is a cost to your business in order to pay less tax']"
set apart,Graf’s natural athleticism set her apart from other tennis players.,"['to keep something separate in order to use it for a particular purpose', 'to make someone or something different and special']"
set apart,Several acres of public land have been set apart for recreation.,"['to keep something separate in order to use it for a particular purpose', 'to make someone or something different and special']"
set aside,Councils have a duty to identify how many new homes will be needed in their area and set aside suitable land.,"['to keep or save something from a larger amount or supply in order to use it later for a particular purpose', 'to not let a particular feeling, opinion, or belief influence you, in order to achieve something more important', 'to officially state that a particular legal decision will no longer be followed']"
set aside,Set aside time to look at plans to make extra money at home.,"['to keep or save something from a larger amount or supply in order to use it later for a particular purpose', 'to not let a particular feeling, opinion, or belief influence you, in order to achieve something more important', 'to officially state that a particular legal decision will no longer be followed']"
set back,"Jim’s new car must have set him back £30,000.","['to cost someone a particular amount of money, especially a large amount', 'to delay the progress of someone or something']"
set back,There will be a few others set back weeks after getting stuck into the ales.,"['to cost someone a particular amount of money, especially a large amount', 'to delay the progress of someone or something']"
set down,A moment later the old woman came back and set down a big glass of water and a basket of hush puppies.,"['to consider something in a particular way', 'to state officially how something should be done', 'to stop a vehicle so that a passenger can get out', 'to write something on a piece of paper so that it will not be forgotten and can be looked at later']"
set down,Emma set down the food on top of a box containing cartons of soap powder.,"['to consider something in a particular way', 'to state officially how something should be done', 'to stop a vehicle so that a passenger can get out', 'to write something on a piece of paper so that it will not be forgotten and can be looked at later']"
set forth,"Frodo passes the Cross-roads, and sees the Morgul-host set forth.","['to explain or describe something in a clear and detailed way, especially in writing', 'to start a journey, especially one that is long or difficult']"
set forth,"the original plan, and set forth warily to sample vicarious parenthood.","['to explain or describe something in a clear and detailed way, especially in writing', 'to start a journey, especially one that is long or difficult']"
set in,He wondered how much of his current unease was due to the forces that had been set in motion by the Letter.,"['if something unpleasant sets in, it starts to happen and have an effect, and is not likely to stop for a long time']"
set in,"It was set in the main body of the park reached through a wrought-iron gate, intricately moulded into beguiling patterns.","['if something unpleasant sets in, it starts to happen and have an effect, and is not likely to stop for a long time']"
set off,We set off early the next morning.,"['to cause a situation or a series of events to happen, especially without intending to', 'to cause something to operate, especially by accident', 'to make someone or something look more attractive by being clearly different from them', 'to make someone start to laugh, cry, or talk a lot', 'to make something explode', 'to start a journey, or to start going in a particular direction']"
set off,Her plain blue dress was set off by a feather-trimmed hat.,"['to cause a situation or a series of events to happen, especially without intending to', 'to cause something to operate, especially by accident', 'to make someone or something look more attractive by being clearly different from them', 'to make someone start to laugh, cry, or talk a lot', 'to make something explode', 'to start a journey, or to start going in a particular direction']"
set off against,The quality of the facilities must be set off against the cost of using them.,"['same as set against', 'to compare one thing with another']"
set off against,Claims for expenses can be set off against tax.,"['same as set against', 'to compare one thing with another']"
set on,I feel like I've wasted everything that's been set on my table.,"['to attack someone or something', 'to tell a person or animal to attack another person or animal']"
set on,"The lodging was dark, save for a little lantern set on the table.","['to attack someone or something', 'to tell a person or animal to attack another person or animal']"
set out,You deliberately set out to torment another living creature.,"['to explain, describe, or arrange something in a clear and detailed way, especially in writing', 'to put something where it can be seen or used', 'to start a journey', 'to start doing or working on something in order to achieve an aim']"
set out,I let her walk a long way ahead until I could only just make her out and then I set out after her.,"['to explain, describe, or arrange something in a clear and detailed way, especially in writing', 'to put something where it can be seen or used', 'to start a journey', 'to start doing or working on something in order to achieve an aim']"
set to,He's also set to rake it in promoting the channel's range of fitness supplements.,['to start doing something in a determined or enthusiastic way']
set to,The example they set to thousands of young people attending mosques out of school hours is of utmost importance.,['to start doing something in a determined or enthusiastic way']
set up,I’ll set up a meeting for Thursday.,"['to arrange a situation so that someone is blamed for doing something, especially something illegal', 'to arrange for two people who you know to go out together because you think they might like each other', 'to begin living in a particular place or with a particular person', 'to build a structure, or to put it in a particular place', 'to claim to be something that you are not', 'to make a piece of equipment ready for use', 'to make it possible for someone to start a business, organization, or institution', 'to make something start to happen', 'to organize or plan something such as an event or system', 'to prepare someone for something', 'to provide someone with enough money so that they do not have to work for the rest of their life', 'to put a tent in an upright position, or to build a shelter somewhere', 'to put someone in a position of power', 'to put your possessions or equipment in a particular place so that you can live, work, or spend a lot of time there', 'to start something such as a business, organization, or institution']"
set up,a plan to set him up as party leader,"['to arrange a situation so that someone is blamed for doing something, especially something illegal', 'to arrange for two people who you know to go out together because you think they might like each other', 'to begin living in a particular place or with a particular person', 'to build a structure, or to put it in a particular place', 'to claim to be something that you are not', 'to make a piece of equipment ready for use', 'to make it possible for someone to start a business, organization, or institution', 'to make something start to happen', 'to organize or plan something such as an event or system', 'to prepare someone for something', 'to provide someone with enough money so that they do not have to work for the rest of their life', 'to put a tent in an upright position, or to build a shelter somewhere', 'to put someone in a position of power', 'to put your possessions or equipment in a particular place so that you can live, work, or spend a lot of time there', 'to start something such as a business, organization, or institution']"
set upon,He was set upon by three men who stole his laptop as he held it up to film the scene with a webcam.,['to attack someone or something']
set upon,This was an horrendous crime on a man of 24 just walking home with his girlfriend when he was set upon by those three drunken yobs.,['to attack someone or something']
